{
 "schemaVersion": 1,
 "id": "model-fingerprint-bank",
 "version": "2026.10.21.1",
 "channel": "stable",
 "source": {
  "repository": "https://github.com/kiss-kedaya/chanshui",
  "upstreamRepository": "xqy2006/ModelTrace",
  "upstreamCommit": "6cd4a8ff0f3f4e49d6d6969dd2fbadfa1569fde2",
  "upstreamPath": "data/unified_bank.json",
  "syncedAt": "2026-10-16T08:23:12.192Z",
  "builtAt": "2026-10-09T06:24:27.469312+00:00",
  "vendoredAt": "2026-10-21"
 },
 "numeric": {
  "method": {
   "name": "Ordered-block + nuisance-Hellinger",
   "range": [
    1,
    355
   ],
   "alpha": 0.5,
   "ordered_block_weight": 0.25,
   "parser": "longest digit run; alphabetic separators split runs; retain values 1..355",
   "response_score": "shared nuisance-Hellinger and ordered-block environment/nuisance fusion",
   "aggregation": "mean of response-wise fused class z-scores",
   "probability": "uniform-prior softmax with fusion-specific grouped cross-validation temperature scaling"
  },
  "minimumValidNumbers": 80,
  "calibration": {
   "1": {
    "beta": 7.129535,
    "cv_accuracy": 0.962963,
    "cv_correct": 624,
    "cv_samples": 648,
    "cv_nll": 0.157701,
    "fallback": false
   },
   "2": {
    "beta": 12.0,
    "cv_accuracy": 0.996914,
    "cv_correct": 646,
    "cv_samples": 648,
    "cv_nll": 0.015228,
    "fallback": false
   },
   "3": {
    "beta": 12.0,
    "cv_accuracy": 1,
    "cv_correct": 216,
    "cv_samples": 216,
    "cv_nll": 0.002564,
    "fallback": false
   }
  },
  "models": [
   {
    "id": "gpt-5.4",
    "displayName": "gpt-5.4",
    "family": "gpt",
    "validNumberCount": 10743,
    "counts": [
     19,
     20,
     23,
     28,
     32,
     37,
     36,
     35,
     35,
     27,
     35,
     39,
     36,
     37,
     30,
     37,
     39,
     37,
     35,
     27,
     35,
     33,
     32,
     38,
     30,
     33,
     40,
     36,
     31,
     28,
     35,
     29,
     30,
     34,
     31,
     33,
     30,
     26,
     33,
     26,
     36,
     34,
     35,
     35,
     28,
     34,
     37,
     33,
     35,
     30,
     30,
     37,
     36,
     41,
     27,
     36,
     40,
     42,
     37,
     30,
     36,
     33,
     39,
     36,
     32,
     36,
     35,
     33,
     37,
     27,
     37,
     34,
     34,
     35,
     29,
     35,
     29,
     31,
     32,
     28,
     35,
     34,
     34,
     40,
     27,
     32,
     34,
     37,
     34,
     30,
     34,
     34,
     33,
     36,
     35,
     32,
     40,
     30,
     29,
     22,
     30,
     29,
     22,
     34,
     19,
     25,
     36,
     28,
     36,
     30,
     35,
     31,
     31,
     30,
     34,
     30,
     33,
     38,
     35,
     32,
     35,
     27,
     31,
     31,
     28,
     34,
     31,
     27,
     32,
     25,
     28,
     33,
     32,
     33,
     23,
     33,
     25,
     30,
     32,
     34,
     34,
     31,
     34,
     32,
     35,
     36,
     37,
     29,
     36,
     26,
     36,
     33,
     33,
     38,
     25,
     31,
     35,
     32,
     31,
     31,
     27,
     26,
     29,
     31,
     26,
     27,
     30,
     29,
     31,
     31,
     38,
     33,
     35,
     33,
     29,
     33,
     32,
     27,
     27,
     15,
     30,
     27,
     24,
     36,
     32,
     33,
     32,
     31,
     17,
     32,
     24,
     30,
     33,
     33,
     20,
     28,
     30,
     34,
     35,
     20,
     36,
     20,
     31,
     23,
     34,
     30,
     28,
     27,
     24,
     29,
     24,
     28,
     25,
     37,
     21,
     33,
     25,
     22,
     33,
     27,
     30,
     20,
     29,
     29,
     31,
     22,
     31,
     25,
     23,
     29,
     30,
     28,
     31,
     31,
     27,
     31,
     24,
     21,
     35,
     31,
     30,
     29,
     31,
     32,
     24,
     26,
     31,
     33,
     26,
     23,
     26,
     30,
     24,
     22,
     26,
     21,
     34,
     27,
     20,
     29,
     28,
     19,
     22,
     31,
     21,
     33,
     25,
     13,
     25,
     24,
     38,
     30,
     29,
     37,
     26,
     25,
     19,
     28,
     30,
     30,
     33,
     28,
     36,
     31,
     25,
     34,
     41,
     32,
     37,
     35,
     32,
     28,
     30,
     38,
     28,
     32,
     28,
     26,
     36,
     28,
     34,
     32,
     31,
     28,
     25,
     25,
     31,
     30,
     20,
     22,
     31,
     31,
     26,
     32,
     33,
     28,
     31,
     32,
     32,
     30,
     33,
     17,
     29,
     32,
     31,
     30,
     25,
     15,
     18,
     28,
     19,
     29,
     32,
     33,
     25,
     21,
     33,
     32,
     31,
     26,
     33,
     22,
     31,
     37,
     29,
     29,
     33,
     27,
     30,
     29,
     25,
     30,
     20,
     23,
     35
    ]
   },
   {
    "id": "gpt-5.5",
    "displayName": "gpt-5.5",
    "family": "gpt",
    "validNumberCount": 10681,
    "counts": [
     20,
     25,
     32,
     29,
     34,
     38,
     38,
     33,
     35,
     30,
     35,
     38,
     34,
     34,
     37,
     33,
     33,
     36,
     31,
     28,
     32,
     30,
     30,
     36,
     31,
     34,
     35,
     29,
     33,
     34,
     35,
     27,
     34,
     32,
     33,
     36,
     31,
     34,
     39,
     32,
     32,
     29,
     32,
     36,
     35,
     32,
     31,
     30,
     33,
     30,
     31,
     32,
     33,
     33,
     35,
     32,
     35,
     38,
     33,
     32,
     33,
     30,
     35,
     36,
     26,
     32,
     36,
     35,
     34,
     37,
     33,
     38,
     35,
     33,
     33,
     35,
     30,
     27,
     31,
     31,
     26,
     31,
     31,
     32,
     24,
     32,
     29,
     35,
     35,
     29,
     37,
     28,
     30,
     33,
     27,
     29,
     36,
     30,
     35,
     33,
     34,
     28,
     21,
     30,
     32,
     18,
     23,
     34,
     32,
     35,
     30,
     34,
     21,
     20,
     26,
     34,
     30,
     34,
     36,
     30,
     33,
     28,
     27,
     32,
     28,
     26,
     15,
     25,
     24,
     29,
     29,
     32,
     19,
     32,
     26,
     30,
     33,
     26,
     29,
     21,
     30,
     31,
     27,
     20,
     36,
     26,
     35,
     31,
     33,
     22,
     30,
     33,
     28,
     35,
     19,
     33,
     27,
     33,
     22,
     31,
     29,
     15,
     18,
     30,
     24,
     28,
     32,
     24,
     34,
     16,
     25,
     30,
     26,
     29,
     30,
     26,
     30,
     17,
     19,
     15,
     29,
     13,
     28,
     27,
     33,
     31,
     32,
     27,
     22,
     37,
     27,
     14,
     24,
     29,
     30,
     33,
     30,
     34,
     34,
     10,
     34,
     26,
     31,
     32,
     35,
     22,
     27,
     25,
     23,
     10,
     27,
     26,
     24,
     36,
     29,
     31,
     28,
     31,
     33,
     22,
     30,
     23,
     29,
     27,
     25,
     31,
     17,
     29,
     35,
     20,
     32,
     32,
     33,
     27,
     29,
     31,
     23,
     31,
     33,
     28,
     26,
     27,
     20,
     32,
     18,
     32,
     33,
     24,
     31,
     28,
     30,
     31,
     21,
     28,
     26,
     18,
     24,
     31,
     29,
     35,
     20,
     25,
     26,
     29,
     29,
     33,
     31,
     29,
     29,
     34,
     35,
     17,
     15,
     37,
     30,
     37,
     22,
     30,
     26,
     25,
     31,
     22,
     24,
     26,
     20,
     26,
     33,
     31,
     28,
     28,
     36,
     31,
     19,
     30,
     32,
     30,
     26,
     25,
     34,
     33,
     42,
     34,
     34,
     34,
     36,
     29,
     37,
     32,
     35,
     34,
     31,
     32,
     22,
     34,
     35,
     34,
     35,
     38,
     36,
     32,
     36,
     31,
     22,
     34,
     32,
     36,
     31,
     18,
     25,
     34,
     33,
     34,
     35,
     34,
     33,
     29,
     36,
     35,
     40,
     40,
     38,
     36,
     34,
     37,
     38,
     39,
     43,
     41,
     41,
     43,
     38,
     37,
     37,
     37,
     38
    ]
   },
   {
    "id": "gpt-5.6-sol",
    "displayName": "gpt-5.6-sol",
    "family": "gpt",
    "validNumberCount": 10651,
    "counts": [
     10,
     13,
     24,
     22,
     31,
     29,
     33,
     30,
     35,
     27,
     36,
     34,
     26,
     36,
     28,
     30,
     30,
     34,
     31,
     32,
     33,
     23,
     22,
     34,
     26,
     27,
     36,
     32,
     28,
     23,
     35,
     29,
     29,
     31,
     29,
     31,
     25,
     26,
     31,
     24,
     33,
     35,
     31,
     33,
     34,
     35,
     35,
     32,
     33,
     28,
     27,
     32,
     34,
     34,
     26,
     33,
     34,
     32,
     32,
     20,
     34,
     30,
     32,
     35,
     30,
     29,
     35,
     35,
     35,
     31,
     31,
     31,
     36,
     36,
     27,
     35,
     30,
     26,
     32,
     26,
     30,
     31,
     35,
     33,
     29,
     33,
     34,
     29,
     33,
     32,
     36,
     29,
     28,
     31,
     30,
     33,
     35,
     30,
     33,
     32,
     34,
     30,
     26,
     34,
     32,
     27,
     29,
     31,
     34,
     31,
     31,
     29,
     25,
     27,
     31,
     34,
     35,
     30,
     33,
     30,
     34,
     14,
     27,
     32,
     31,
     28,
     32,
     31,
     28,
     34,
     32,
     27,
     20,
     31,
     26,
     32,
     34,
     23,
     28,
     20,
     27,
     28,
     35,
     18,
     35,
     28,
     24,
     34,
     33,
     22,
     31,
     33,
     27,
     36,
     28,
     31,
     34,
     27,
     33,
     34,
     26,
     23,
     20,
     32,
     25,
     30,
     29,
     25,
     36,
     16,
     34,
     31,
     36,
     31,
     32,
     29,
     33,
     29,
     31,
     15,
     33,
     15,
     29,
     36,
     29,
     32,
     35,
     31,